{
  "$schema": "https://json-schema.org/draft/2020-12/schema",
  "title": "HistoricalContext",
  "type": "object",
  "required": [
    "id",
    "name",
    "type",
    "period",
    "summary",
    "status"
  ],
  "properties": {
    "id": {
      "type": "string",
      "pattern": "^[a-z0-9_]+$"
    },
    "name": {
      "type": "string",
      "minLength": 1
    },
    "type": {
      "type": "string"
    },
    "period": {
      "type": "object",
      "required": [
        "start",
        "end",
        "precision"
      ],
      "properties": {
        "start": {
          "type": "integer"
        },
        "end": {
          "type": "integer"
        },
        "precision": {
          "type": "string"
        },
        "display": {
          "type": "string"
        }
      }
    },
    "placeRefs": {
      "type": "array",
      "items": {
        "type": "string"
      }
    },
    "summary": {
      "type": "string"
    },
    "sourceRefs": {
      "type": "array",
      "items": {
        "type": "string"
      }
    },
    "status": {
      "type": "string"
    }
  }
}