[
  {
    "id": "shulaveri_shomutepe",
    "name": "Cultura Shulaveri-Shomutepe",
    "type": "archaeological_culture",
    "period": {
      "start": -5900,
      "end": -5000,
      "precision": "range",
      "display": "ca. 5900–5000 a. C."
    },
    "placeRefs": [
      "gadachrili_gora"
    ],
    "summary": "Cultura del Neolítico cerámico del Cáucaso meridional; PNAS sitúa en este marco los yacimientos de Gadachrili Gora y Shulaveris Gora estudiados para la evidencia temprana de vino.",
    "sourceRefs": [
      "src_mcgovern_2017_neolithic_wine",
      "src_cnrs_gadachrili"
    ],
    "status": "reviewed"
  },
  {
    "id": "roman_empire_west_reference",
    "name": "Mundo imperial romano (referencia occidental)",
    "type": "empire",
    "period": {
      "start": -27,
      "end": 476,
      "precision": "range",
      "display": "27 a. C.–476 d. C. (referencia occidental)"
    },
    "placeRefs": [
      "pompeii"
    ],
    "summary": "Marco político-cultural romano desde Augusto; para Occidente se usa 476 d.C. como cierre convencional. La continuidad oriental debe modelarse mediante contextos propios y no queda absorbida por este registro.",
    "sourceRefs": [
      "src_met_roman_empire",
      "src_met_italy_1_500"
    ],
    "status": "reviewed"
  },
  {
    "id": "natufian",
    "name": "Natufiense",
    "type": "archaeological_culture",
    "period": {
      "start": -13050,
      "end": -9550,
      "precision": "range",
      "display": "ca. 13.050–9.550 a. C.",
      "note": "Rango contextual aproximado; el registro concreto de Shubayqa conserva su datación propia."
    },
    "placeRefs": [
      "shubayqa_1"
    ],
    "summary": "Complejo arqueológico epipaleolítico del Levante; Shubayqa 1 aporta una secuencia natufiense temprana y tardía.",
    "sourceRefs": [
      "src_shubayqa_dates_2017",
      "src_shubayqa_bread_pnas_2018"
    ],
    "status": "reviewed"
  },
  {
    "id": "richard_ii_royal_household",
    "name": "Casa real inglesa de Ricardo II",
    "type": "institution",
    "period": {
      "start": 1377,
      "end": 1399,
      "precision": "range",
      "display": "1377–1399"
    },
    "placeRefs": [
      "england_richard_ii_reference"
    ],
    "summary": "Contexto cortesano asociado a la composición de The Forme of Cury por los cocineros principales de Ricardo II.",
    "sourceRefs": [
      "src_forme_cury_bl"
    ],
    "status": "reviewed"
  },
  {
    "id": "naqada_iiia2_dynasty_0",
    "name": "Naqada IIIa2 / Dinastía 0",
    "type": "archaeological_culture",
    "period": {
      "start": -3250,
      "end": -3100,
      "precision": "range",
      "display": "ca. 3250–3100 a. C."
    },
    "placeRefs": [
      "abydos_umm_el_qaab"
    ],
    "summary": "Marco protodinástico de la tumba U-j de Abydos; se usa solo como contexto del registro funerario y no como una afirmación de origen del vino.",
    "sourceRefs": [
      "src_abydos_wine_2009"
    ],
    "status": "reviewed"
  },
  {
    "id": "tel_kabri_middle_bronze_palace",
    "name": "Polidad palacial cananea de Tel Kabri",
    "type": "polity",
    "period": {
      "start": -1900,
      "end": -1600,
      "precision": "range",
      "display": "ca. 1900–1600 a. C."
    },
    "placeRefs": [
      "tel_kabri"
    ],
    "summary": "Contexto palacial cananeo del Bronce Medio asociado al gran complejo de almacenamiento de Tel Kabri.",
    "sourceRefs": [
      "src_tel_kabri_wine_2014",
      "src_tel_kabri_archaeobotany_2023"
    ],
    "status": "reviewed"
  },
  {
    "id": "princess_point_complex",
    "name": "Princess Point Complex",
    "type": "archaeological_culture",
    "period": {
      "start": 500,
      "end": 1000,
      "precision": "range",
      "display": "ca. siglos VI–X d. C."
    },
    "placeRefs": [
      "lower_great_lakes_region"
    ],
    "summary": "Complejo arqueológico Late Woodland del sur de Ontario asociado a la presencia temprana de maíz directamente datado en la región.",
    "sourceRefs": [
      "src_crawford_lower_great_lakes_2017"
    ],
    "status": "reviewed"
  }
]